{
  "$schema": "http://json-schema.org/draft-04/schema#",
  "type": "object",
  "properties": {
    "event": {
      "type": "string"
    },
    "message": {
      "type": "string"
    },
    "sent_at": {
      "type": "string",
      "format": "date-time"
    },
    "user": {
      "type": "object",
      "properties": {
        "id": {
          "type": "string"
        },
        "username": {
          "type": "string"
        },
        "name": {
          "type": [
            "string",
            "null"
          ]
        },
        "gravatar_uid": {
          "type": [
            "string",
            "null"
          ]
        }
      },
      "required": [
        "id",
        "username",
        "name",
        "gravatar_uid"
      ]
    },
    "project": {
      "type": "object",
      "properties": {
        "id": {
          "type": "string"
        },
        "name": {
          "type": "string"
        },
        "main_format": {
          "type": [
            "string",
            "null"
          ]
        },
        "created_at": {
          "type": "string",
          "format": "date-time"
        },
        "updated_at": {
          "type": "string",
          "format": "date-time"
        }
      },
      "required": [
        "id",
        "name",
        "main_format",
        "created_at",
        "updated_at"
      ]
    },
    "branch": {
      "type": "object",
      "properties": {
        "name": {
          "type": "string"
        }
      },
      "required": [
        "name"
      ]
    },
    "comment": {
      "type": "object",
      "title": "comment",
      "properties": {
        "id": {
          "type": "string"
        },
        "message": {
          "type": "string"
        },
        "user": {
          "type": [
            "object",
            "null"
          ],
          "properties": {
            "id": {
              "type": "string"
            },
            "username": {
              "type": "string"
            },
            "name": {
              "type": [
                "string",
                "null"
              ]
            },
            "gravatar_uid": {
              "type": [
                "string",
                "null"
              ]
            }
          },
          "required": [
            "id",
            "username",
            "name",
            "gravatar_uid"
          ]
        },
        "created_at": {
          "type": "string",
          "format": "date-time"
        },
        "updated_at": {
          "type": "string",
          "format": "date-time"
        },
        "mentioned_users": {
          "type": "array",
          "items": {
            "type": "object",
            "properties": {
              "id": {
                "type": "string"
              },
              "username": {
                "type": "string"
              },
              "name": {
                "type": [
                  "string",
                  "null"
                ]
              },
              "gravatar_uid": {
                "type": [
                  "string",
                  "null"
                ]
              }
            },
            "required": [
              "id",
              "username",
              "name",
              "gravatar_uid"
            ]
          }
        },
        "key": {
          "type": "object",
          "properties": {
            "id": {
              "type": "string"
            },
            "name": {
              "type": "string"
            },
            "description": {
              "type": [
                "string",
                "null"
              ]
            },
            "name_hash": {
              "type": [
                "string",
                "null"
              ]
            },
            "plural": {
              "type": "boolean"
            },
            "max_characters_allowed": {
              "type": [
                "integer",
                "null"
              ]
            },
            "tags": {
              "type": "array",
              "items": {
                "type": "string"
              }
            },
            "created_at": {
              "type": "string",
              "format": "date-time"
            },
            "updated_at": {
              "type": "string",
              "format": "date-time"
            }
          },
          "required": [
            "id",
            "name",
            "description",
            "name_hash",
            "plural",
            "max_characters_allowed",
            "tags",
            "created_at",
            "updated_at"
          ]
        }
      },
      "required": [
        "id",
        "message",
        "user",
        "created_at",
        "updated_at",
        "mentioned_users"
      ]
    }
  },
  "required": [
    "event",
    "message",
    "user",
    "project"
  ]
}
