{
  "event": "comments:create",
  "message": "john.smith commented on job \"Job 1\" in project Translation Project within branch new-feature-1",
  "sent_at": "2025-02-07 16:44:04 UTC",
  "user": {
    "id": "24b9a53ad72e198ca332fba91bb95f57",
    "username": "john.smith",
    "name": "John Smith",
    "gravatar_uid": "1bc5edb4799fd8eec67c66122f47eb73"
  },
  "project": {
    "id": "b2abd3bd2c23ff0ac546e0a2d9aa0be1",
    "name": "Translation Project",
    "slug": "translation-project",
    "main_format": "yml",
    "project_image_url": null,
    "created_at": "2025-02-07 16:18:13 UTC",
    "updated_at": "2025-02-07 16:18:13 UTC",
    "point_of_contact": null
  },
  "branch": {
    "name": "new-feature-1"
  },
  "comment": {
    "id": "68740d06f87390fd357f12e0d7ddb9a2",
    "message": "Job is looking ready to go",
    "has_replies": false,
    "created_at": "2025-02-07 16:18:13 UTC",
    "updated_at": "2025-02-07 16:18:13 UTC",
    "user": {
      "id": "24b9a53ad72e198ca332fba91bb95f57",
      "username": "john.smith",
      "name": "John Smith",
      "gravatar_uid": "1bc5edb4799fd8eec67c66122f47eb73"
    },
    "mentioned_users": [],
    "locales": []
  }
}